{
  "generated_by": "scripts/refresh_rule_versions.py",
  "rules": {
    "EXC_EMPTY_CATCH_JS_001": {
      "history": [
        "0508ddf7df859091de1f3538363d2b233c7d7993ebfdceee0a580eab2b68a9c2",
        "2e0327b0a98eba1686134bd8901c7686be31c771843324cc986bbd2305bb3fb8"
      ],
      "rule_logic_version": 2,
      "semantic_hash": "2e0327b0a98eba1686134bd8901c7686be31c771843324cc986bbd2305bb3fb8"
    },
    "GST_GLOBAL_THIS_MUTATION_001": {
      "history": [
        "5f5cbee64c675834477b26938f8c3c69d4ab803cd8da270ae05202eb2ffa78d5",
        "cf47ef4914878012ce770a575eb31ef18f7d7066c2de8b36970cec839cc31076"
      ],
      "rule_logic_version": 2,
      "semantic_hash": "cf47ef4914878012ce770a575eb31ef18f7d7066c2de8b36970cec839cc31076"
    },
    "SEC_DYNAMIC_MODULE_LOAD_JS_001": {
      "history": [
        "a9dbdb51f2fb4e22737b2bcfc25194746a72f0f919ad0eb1882b81eecf7556e3",
        "879937a5be6a82c02e456300f775cb05a94768373136b09af301414155369807"
      ],
      "rule_logic_version": 2,
      "semantic_hash": "879937a5be6a82c02e456300f775cb05a94768373136b09af301414155369807"
    },
    "SEC_EVAL_JS_001": {
      "history": [
        "69d731ff57e692fb203f9a5f215d1c4a5e9bef6f7aacd107744e37b4c9a37bd1",
        "37e5012429892bc32345d9dc3ee600f2d34cb70fb3ca811f0ad6d15db6e98e19"
      ],
      "rule_logic_version": 2,
      "semantic_hash": "37e5012429892bc32345d9dc3ee600f2d34cb70fb3ca811f0ad6d15db6e98e19"
    },
    "SEC_NEW_FUNCTION_JS_001": {
      "history": [
        "08ee0c43c4600535a77ec0e6628a073cea995c8eeca5fd3832da958d3dfb93bf",
        "276ebdb9d63564f24a0ceb569390e2241c85588fd58ba2480fe83f8094b71aee"
      ],
      "rule_logic_version": 2,
      "semantic_hash": "276ebdb9d63564f24a0ceb569390e2241c85588fd58ba2480fe83f8094b71aee"
    }
  },
  "schema_version": 2,
  "signal_logic_version": "signals_v5"
}
